{
  "contract": "dataground.audit-export-delivery-destination/s3/v1",
  "deliveryId": "adl_00000000000000000001",
  "isolationDomainId": "iso_00000000000000000001",
  "recipientId": "archive.primary",
  "transportContract": "dataground.audit-export-transport/s3-immutable/v1",
  "endpoint": "http://127.0.0.1:8333",
  "bucket": "dataground-development",
  "addressingStyle": "path",
  "objectKey": "audit-export-deliveries/v1/iso_00000000000000000001/adl_00000000000000000001/5555555555555555555555555555555555555555555555555555555555555555.json"
}
